<?xml version="1.0"?>
<!--
/**
 * @author Amasty Team
 * @copyright Copyright (c) 2020 Amasty (https://www.amasty.com)
 * @package Amasty_ProductExportEntity
 */
-->
<config xmlns:xsi="http://www.w3.org/2001/XMLSchema-instance"
        xsi:noNamespaceSchemaLocation="urn:amasty:module:Amasty_ExportCore:etc/am_export.xsd">
    <entity code="catalog_product_entity_inventory_stock_status">
        <name>Inventory Stock Status</name>
        <group>Product</group>
        <enabledChecker class="Amasty\ExportCore\Export\Config\IsModuleDisabled">
            <arguments>
                <argument name="moduleName" xsi:type="string">Magento_Inventory</argument>
            </arguments>
        </enabledChecker>
        <collectionFactory class="Amasty\ProductExportEntity\Model\ResourceModel\CatalogInventory\Stock\Status\CollectionFactory"/>
        <fieldsConfig>
            <fieldsClass class="Amasty\ExportCore\Export\FieldsClass\Describe"/>
            <fields>
                <field name="stock_id">
                    <actions>
                        <custom class="Amasty\ProductExportEntity\Export\DataHandling\FieldModifier\CatalogInventory\StockId2StockName"/>
                    </actions>
                </field>
                <field name="stock_status">
                    <filter>
                        <type>select</type>
                        <options>
                            <class>Magento\CatalogInventory\Model\Source\Stock</class>
                        </options>
                    </filter>
                </field>
                <field name="website_id">
                    <actions>
                        <custom class="Amasty\ProductExportEntity\Export\DataHandling\FieldModifier\WebsiteId2WebsiteCode"/>
                    </actions>
                    <filter>
                        <type>select</type>
                        <options>
                            <class>Amasty\ProductExportEntity\Export\Product\SourceOption\WebsiteOptions</class>
                        </options>
                    </filter>
                </field>
            </fields>
        </fieldsConfig>
    </entity>
    <relation code="catalog_product_entity_inventory_stock_status">
        <parent_entity>catalog_product_entity</parent_entity>
        <child_entity>catalog_product_entity_inventory_stock_status</child_entity>
        <sub_entity_field_name>inventory_stock_status</sub_entity_field_name>
        <type>one_to_many</type>
        <arguments>
            <argument name="parent_entity_name" xsi:type="string">Magento\Catalog\Api\Data\ProductInterface</argument>
            <argument name="child_field_name" xsi:type="string">product_id</argument>
        </arguments>
    </relation>
    <relation code="inventory_stock_status_catalog_product_entity">
        <parent_entity>catalog_product_entity_inventory_stock_status</parent_entity>
        <child_entity>catalog_product_entity</child_entity>
        <sub_entity_field_name>catalog_product_entity</sub_entity_field_name>
        <type>one_to_many</type>
        <arguments>
            <argument name="parent_field_name" xsi:type="string">product_id</argument>
            <argument name="child_entity_name" xsi:type="string">Magento\Catalog\Api\Data\ProductInterface</argument>
        </arguments>
    </relation>
</config>
