<?xml version="1.0"?>
<!--
/**
 * @author Amasty Team
 * @copyright Copyright (c) 2020 Amasty (https://www.amasty.com)
 * @package Amasty_ProductExportEntity
 */
-->
<config xmlns:xsi="http://www.w3.org/2001/XMLSchema-instance"
        xsi:noNamespaceSchemaLocation="urn:amasty:module:Amasty_ExportCore:etc/am_export.xsd">
    <entity code="catalog_product_entity_tier_price">
        <name>Customer Group Price</name>
        <group>Product</group>
        <collectionFactory class="Amasty\ProductExportEntity\Model\ResourceModel\Product\TierPrice\CollectionFactory"/>
        <fieldsConfig>
            <fieldsClass class="Amasty\ExportCore\Export\FieldsClass\Describe"/>
            <fields>
                <field name="all_groups">
                    <filter>
                        <type>toggle</type>
                    </filter>
                </field>
                <field name="customer_group_id">
                    <actions>
                        <custom class="Amasty\ProductExportEntity\Export\DataHandling\FieldModifier\Customer\GroupId2GroupCode"/>
                    </actions>
                    <filter>
                        <type>select</type>
                        <options>
                            <class>Amasty\ExportCore\Export\SourceOption\CustomerGroupOptions</class>
                        </options>
                    </filter>
                </field>
                <field name="website_id">
                    <actions>
                        <custom class="Amasty\ProductExportEntity\Export\DataHandling\FieldModifier\WebsiteId2WebsiteCode"/>
                    </actions>
                    <filter>
                        <type>select</type>
                        <options>
                            <class>Amasty\ProductExportEntity\Export\Product\SourceOption\WebsiteOptions</class>
                        </options>
                    </filter>
                </field>
            </fields>
        </fieldsConfig>
    </entity>
    <relation code="catalog_product_entity_tier_price">
        <parent_entity>catalog_product_entity</parent_entity>
        <child_entity>catalog_product_entity_tier_price</child_entity>
        <sub_entity_field_name>catalog_product_tier_price</sub_entity_field_name>
        <type>one_to_many</type>
        <arguments>
            <argument name="parent_entity_name" xsi:type="string">Magento\Catalog\Api\Data\ProductInterface</argument>
            <argument name="child_entity_name" xsi:type="string">Magento\Catalog\Api\Data\ProductInterface</argument>
        </arguments>
    </relation>
    <relation code="tier_price_catalog_product_entity">
        <parent_entity>tier_price_catalog_product_entity</parent_entity>
        <child_entity>catalog_product_entity</child_entity>
        <sub_entity_field_name>catalog_product_entity</sub_entity_field_name>
        <type>one_to_many</type>
        <arguments>
            <argument name="parent_entity_name" xsi:type="string">Magento\Catalog\Api\Data\ProductInterface</argument>
            <argument name="child_entity_name" xsi:type="string">Magento\Catalog\Api\Data\ProductInterface</argument>
        </arguments>
    </relation>
</config>
