<?xml version="1.0"?>
<!--
/**
 * @author Amasty Team
 * @copyright Copyright (c) 2020 Amasty (https://www.amasty.com)
 * @package Amasty_ProductExportEntity
 */
-->
<config xmlns:xsi="http://www.w3.org/2001/XMLSchema-instance"
        xsi:noNamespaceSchemaLocation="urn:amasty:module:Amasty_ExportCore:etc/am_export.xsd">
    <entity code="catalog_product_entity_related_links">
        <name>Related Product Link</name>
        <group>Product</group>
        <collectionFactory class="Amasty\ProductExportEntity\Model\ResourceModel\Product\Link\RelatedCollectionFactory"/>
        <fieldsConfig>
            <fieldsClass class="Amasty\ExportCore\Export\FieldsClass\Describe"/>
            <fields>
                <field name="sku">
                    <filter>
                        <type>text</type>
                    </filter>
                </field>
                <field name="position">
                    <filter>
                        <type>text</type>
                    </filter>
                </field>
            </fields>
        </fieldsConfig>
    </entity>
    <relation code="catalog_product_entity_related_links">
        <parent_entity>catalog_product_entity</parent_entity>
        <child_entity>catalog_product_entity_related_links</child_entity>
        <sub_entity_field_name>catalog_product_related</sub_entity_field_name>
        <type>one_to_many</type>
        <arguments>
            <argument name="parent_entity_name" xsi:type="string">Magento\Catalog\Api\Data\ProductInterface</argument>
            <argument name="child_field_name" xsi:type="string">product_id</argument>
        </arguments>
    </relation>
    <relation code="related_links_catalog_product_entity">
        <parent_entity>catalog_product_entity_related_links</parent_entity>
        <child_entity>catalog_product_entity</child_entity>
        <sub_entity_field_name>catalog_product_entity</sub_entity_field_name>
        <type>one_to_many</type>
        <arguments>
            <argument name="parent_field_name" xsi:type="string">product_id</argument>
            <argument name="child_entity_name" xsi:type="string">Magento\Catalog\Api\Data\ProductInterface</argument>
        </arguments>
    </relation>
</config>
