<?xml version="1.0"?>
<!--
/**
 * @author Amasty Team
 * @copyright Copyright (c) 2020 Amasty (https://www.amasty.com)
 * @package Amasty_InventoryExportEntity
 */
-->
<config xmlns:xsi="http://www.w3.org/2001/XMLSchema-instance"
        xsi:noNamespaceSchemaLocation="urn:amasty:module:Amasty_ExportCore:etc/am_export.xsd">
    <entity code="inventory_reservation">
        <name>Inventory Reservation</name>
        <group>Inventory</group>
        <enabledChecker class="Amasty\ExportCore\Export\Config\IsModuleEnabled">
            <arguments>
                <argument name="moduleName" xsi:type="string">Magento_Inventory</argument>
            </arguments>
        </enabledChecker>
        <collectionFactory class="Amasty\InventoryExportEntity\Model\ResourceModel\Reservation\CollectionFactory"/>
        <fieldsConfig>
            <fieldsClass class="Amasty\ExportCore\Export\FieldsClass\Describe"/>
        </fieldsConfig>
    </entity>
    <relation code="inventory_stock_reservation">
        <parent_entity>inventory_stock</parent_entity>
        <child_entity>inventory_reservation</child_entity>
        <sub_entity_field_name>inventory_reservation</sub_entity_field_name>
        <type>one_to_many</type>
        <arguments>
            <argument name="parent_field_name" xsi:type="string">stock_id</argument>
            <argument name="child_field_name" xsi:type="string">stock_id</argument>
        </arguments>
    </relation>
    <relation code="reservation_inventory_stock">
        <parent_entity>inventory_reservation</parent_entity>
        <child_entity>inventory_stock</child_entity>
        <sub_entity_field_name>inventory_stock</sub_entity_field_name>
        <type>one_to_many</type>
        <arguments>
            <argument name="parent_field_name" xsi:type="string">stock_id</argument>
            <argument name="child_field_name" xsi:type="string">stock_id</argument>
        </arguments>
    </relation>
</config>
